Heading,Level 1,Level 2 ,Level 3
About the AWS Training:,,,
,"Amazon Web Services (AWS) is a powerful and versatile cloud computing platform that provides highly reliable and cost-effective services. It allows businesses to seamlessly migrate their infrastructure and applications to the cloud, reducing IT expenses and infrastructure development costs. This AWS Training will guide you through the core concepts of the AWS platform",,
,"In addition, the AWS Course will introduce you to a range of AWS services. You will gain insights into the importance and benefits of these services, as well as how to use and configure them effectively. The course will also cover various cloud concepts and technologies",,
,Key topics covered in the AWS Certification:,,
,,Fundamentals of AWS,
,Prerequisites for the AWS Course: The AWS Training and Certification is designed for professionals who want to learn and master Amazon Web Services.,,
,,Basic computer knowledge of Amazon Web Services Certification,
,,Basic knowledge of AWS,
,,Passion for learning,
,,Fundamental knowledge of cloud computing concepts,
AWS Certification Course Objectives,,,
,"Our AWS Course covers the latest features, benefits, and implementations, ensuring you are equipped with the most up-to-date specifications.",,
,,Provide students with high-quality AWS training,
,,Help students learn the fundamentals of AWS Certification,
,,Help students understand the benefits of using the cloud-computing platform,
,,Make students comfortable in working with various AWS services,
,,Teach students fundamental concepts of cloud computing,
,,Prepare students to clear the AWS certification exam easily,
,,Make students proficient in planning and designing AWS implementations,
,Our AWS Training and Certification faculty will help you:,,
,,Master the fundamentals of AWS,
,,Understand the importance and benefits of cloud computing,
,,Learn how to configure and use different AWS services,
,,Learn how to use different cloud computing technologies,
,,Become an expert in designing AWS implementations,
,,Become comfortable in working with the cloud computing platform,
,,Understand the responsibilities of an AWS solutions architect,
,,Become a confident AWS solutions architect,
